label,sublabel,description,styles,bgcolor
燃えるごみ,,・指定袋に入れてください。<br />・生ごみは、水気をよく切ってください。<br />・紙くず・紙おむつなどの汚物は、落としてください。<br />・食品トレイは軽く洗ってできるだけリサイクル（店頭回収）へ。<br />・植木のせん定くずなどは、長さ５０ｃｍ程度、直径１０ｃｍ程度に小さくしてください。<br />・袋の口は必ず結んでください。,img/moyasu02.svg,#ea3b13
紙類・硬質（製品）プラスチック,,・新聞・チラシは、ひもで十文字にしばってください。<br />・段ボールは、粘着テープ・送り状のカーボン紙をとりはずし、ひもで十文字にしばってください。<br />・雑誌・本・雑紙・紙箱などは、ビニール・セロハンテープなどを取り外し、ひもで十文字にしばってください。小さな雑紙は、封筒や紙袋へいれてください。<br />・紙パックは、洗って開いて乾かしたあと、ひもで十文字にしばってください。<br />・硬質（製品）プラスチックは、シールや値札をはがした後、よく洗い、中がみえるように透明または半透明の袋に入れてください。,img/shigen02.svg,#733b96
容器包装プラスチック,,・「プラ」マークの付いた容器包装プラスチックを出せます（発表スチロール製トレイやペットボトルを除きます）。<br />・ラップなどを取り除き、きれいに洗ってだしてください。<br />・中が見えるよう、透明または半透明のふくろに入れてだしてください。<br />・容器包装以外のプラスチック（道具としてつかわれているもの）は別の日にだしてください。,img/shigen02.svg,#433b96
発泡スチロール・トレイ・飲料缶,,・ラップなどを取り除き、きれいに洗ってだしてください。<br />・発泡スチロール製トレイは、パリッと割れてようじが簡単にささるものと思ってください。<br />・飲料缶（アルミ缶・スチール缶）は、軽く水洗いしてだしてください。中には紙くず、タバコなどをいれないでください。<br />・中が見えるよう、透明または半透明のふくろに入れて出してください。発泡スチロール・トレイと飲料缶の袋は別にしてください。,img/shigen02.svg,#77ae1f
ペットボトル,,・ペット樹脂リサイクルマーク（三角の中に数字の１、三角の下にPETとあるもの）が付いたもので、飲料用・酒類用・醤油などが入っていたものが対象です。<br />・ラベルやキャップは外してください。きれいに洗って乾かしてください。<br />・中が見えるよう、透明または半透明のふくろに入れて出してください。,img/bin02.svg,#2dc7aa
